{
  "gameId": "klondike",
  "displayName": "Klondike Solitaire",
  "version": "1.0.0",
  "decks": 1,
  "suits": ["hearts", "diamonds", "clubs", "spades"],
  "cardValues": [1, 2, 3, 4, 5, 6, 7, 8, 9, 10, 11, 12, 13],
  "piles": {
    "stock": {
      "count": 1,
      "initialCards": "remaining",
      "faceUp": false
    },
    "waste": {
      "count": 1,
      "initialCards": 0,
      "faceUp": true
    },
    "foundations": {
      "count": 4,
      "buildRule": "ascending-same-suit",
      "startsWith": 1,
      "initialCards": 0
    },
    "tableau": {
      "count": 7,
      "buildRule": "descending-alternating-color",
      "emptyColumnRule": "any",
      "initialCards": "cascading",
      "topCardFaceUp": true
    }
  },
  "drawMode": {
    "options": [1, 3],
    "default": 1
  },
  "winCondition": {
    "type": "all-to-foundations"
  },
  "scoring": {
    "wasteToTableau": 5,
    "wasteToFoundation": 10,
    "tableauToFoundation": 10,
    "foundationToTableau": -15,
    "flipCard": 5,
    "timePenaltyInterval": 10,
    "timePenaltyAmount": 2,
    "timePenaltyGracePeriod": 30
  },
  "layout": {
    "type": "klondike-standard",
    "topRow": ["stock", "waste", "gap", "foundation", "foundation", "foundation", "foundation"],
    "bottomRows": ["tableau"]
  },
  "assets": {
    "cardBack": "classic-blue",
    "cardFaceTheme": "standard"
  }
}
